{
  "$schema": "http://json-schema.org/draft-07/schema#",
  "$id": "https://github.com/us-llc-fees-dataset/foreign-qualification/schema/state.schema.json",
  "title": "Foreign LLC qualification, per jurisdiction",
  "description": "DRAFT - the starting contract, expected to change while the pilot runs. Records what it costs and what it takes to register an existing LLC from another state: the registration fee on the common filing path, the official form, the agency that takes the filing, and ongoing obligations as prose. This namespace is authoritative for the foreign registration fee and form; registered-agent eligibility rules live in agent-rules.",
  "type": "object",
  "additionalProperties": false,
  "required": [
    "stateName",
    "stateAbbr",
    "stateSlug",
    "foreignQualification",
    "notes",
    "needsReview",
    "sources",
    "lastVerified"
  ],
  "properties": {
    "stateName": { "type": "string", "minLength": 2 },
    "stateAbbr": { "type": "string", "pattern": "^[A-Z]{2}$" },
    "stateSlug": { "type": "string", "pattern": "^[a-z0-9-]+$" },

    "foreignQualification": {
      "type": "object",
      "additionalProperties": false,
      "required": [
        "registrationFeeUsd",
        "feeBasis",
        "formName",
        "formUrl",
        "filedWith",
        "ongoingObligationsNote",
        "evidence"
      ],
      "properties": {
        "registrationFeeUsd": {
          "type": ["number", "null"],
          "minimum": 0,
          "description": "Real out-of-pocket cost on the common filing path (online or paper); feeBasis names the path and any gap from the statutory figure."
        },
        "feeBasis": {
          "type": "string",
          "description": "What the figure covers: statutory fee, total cost on the common path, online vs paper difference, processor surcharge."
        },
        "formName": {
          "type": "string",
          "description": "The official form's name or number, verbatim (for example 'Application for Registration (Form LLC-5)')."
        },
        "formUrl": {
          "type": ["string", "null"],
          "pattern": "^https?://",
          "description": "The official form page or fee schedule the form and fee were read from."
        },
        "filedWith": {
          "type": ["string", "null"],
          "description": "The agency that takes the filing, verbatim."
        },
        "ongoingObligationsNote": {
          "type": ["string", "null"],
          "description": "One short sentence: what the LLC must do after registering, such as an annual report, agent maintenance or recurring fees. Registered-agent eligibility rules themselves live in agent-rules."
        },
        "evidence": { "$ref": "#/definitions/evidenceList" }
      }
    },

    "notes": {
      "type": "string",
      "description": "Anything the fields cannot carry without lying: definitional calls, excluded costs, boundary cases."
    },
    "needsReview": {
      "type": ["string", "null"],
      "description": "What is missing and what would settle it."
    },
    "sources": {
      "type": "array",
      "minItems": 1,
      "items": {
        "type": "object",
        "additionalProperties": false,
        "required": ["citation", "title", "url", "type", "lastAccessed"],
        "properties": {
          "citation": { "type": "string" },
          "title": { "type": "string" },
          "url": { "type": "string", "pattern": "^https?://" },
          "type": {
            "oneOf": [
              { "type": "null" },
              { "enum": ["statute", "agency-page", "fee-schedule", "official-pdf"] }
            ],
            "description": "Source class, for deriving record confidence mechanically. null where none of the classes fits."
          },
          "lastAccessed": { "type": "string", "pattern": "^\\d{4}-\\d{2}-\\d{2}$" }
        }
      }
    },
    "lastVerified": {
      "type": "string",
      "pattern": "^\\d{4}-\\d{2}-\\d{2}$",
      "description": "The date the cited pages were retrieved and every quoted passage was mechanically confirmed to occur in them."
    }
  },

  "definitions": {
    "evidence": {
      "type": "object",
      "additionalProperties": false,
      "required": ["quote", "url"],
      "properties": {
        "quote": {
          "type": "string",
          "minLength": 20,
          "description": "One contiguous verbatim passage, copied from the page as retrieved, artefacts included. Never assembled across an ellipsis, never taken from a search snippet, never tidied."
        },
        "url": { "type": "string", "pattern": "^https?://" },
        "supports": {
          "type": "string",
          "description": "Which value in the enclosing object this passage grounds, by field name (registrationFeeUsd, formName, ...). A record carrying several passages is only honest if each one says what it is evidence for."
        }
      }
    },
    "evidenceList": {
      "type": "array",
      "minItems": 1,
      "items": { "$ref": "#/definitions/evidence" }
    }
  }
}
